課程名稱,上課地點,開放報名,開課日期,性質,職業分類
東歐花藝美學創作班第01期,新竹市新竹市林森路49號3樓,2022/01/21,2022/02/21,在職,藝術與設計
國際醫療器材法規與開發趨勢實務班第01期,新竹市新竹市光復路２段101號,2022/01/19,2022/02/20,在職,行政與管理
新農業現代化創新農業管理班第02期,新竹市新竹市光復路２段101號,2022/01/16,2022/02/16,在職,行政與管理
智慧機械-Python程式設計基礎班第03期,新竹市新竹市民族路31號10樓,2022/01/16,2022/02/16,在職,科技與資訊技術
智慧機械-工業繪圖與3D列印訓練班第02期,新竹市新竹市民族路31號11樓,2022/01/13,2022/02/21,在職,科技與資訊技術
國際企業經營班一年期日語組,新竹市新竹市,2022/01/11,2022/06/30,青年,行政與管理
國際企業經營班一年期經貿實戰組(新竹),新竹市新竹市,2022/01/11,2022/06/30,青年,行政與管理
AI資料科學家人才養成班 第01期,新竹市,2022/01/10,2022/02/16,職前,科技與資訊技術
光電與AI生醫產業人才養成班(第二梯次),新竹市大學路1001號,2022/01/01,2022/03/15,青年,建築與工程
FPGA 系統晶片設計工程師培訓班(第二梯),新竹市光復路二段3號,2021/12/01,2022/04/01,青年,建築與工程
智慧機械與AI人工智慧技術應用訓練班-第3期,新竹市民族路31號11樓,2021/11/30,2022/01/19,青年,科技與資訊技術
智慧機械製圖設計人才培訓班-第3期,新竹市民族路31號11樓,2021/11/30,2022/02/23,青年,建築與工程
中階實用美語訓練班第01期,新竹市新竹市民族路31號11樓,2021/11/29,2021/12/29,在職,行政與管理
數位影像設計專班 第01期,新竹市,2021/11/24,2022/04/14,職前,藝術與設計
YouTube影音暨微電影技巧班第01期,新竹市新竹市民族路31號11樓,2021/11/23,2021/12/23,在職,科技與資訊技術
植萃應用保養品訓練班第01期,新竹市新竹市光復路２段101號,2021/11/23,2021/12/23,在職,行政與管理
韓式豆沙霜擠花創意班第01期,新竹市新竹市林森路49號3樓,2021/11/19,2021/12/19,在職,餐飲業
電腦影像美編設計(新竹) 第01期,新竹市,2021/11/18,2022/03/15,職前,藝術與設計
智慧機械-Python深度學習程式訓練班第01期,新竹市新竹市民族路31號11樓,2021/11/11,2021/12/25,在職,科技與資訊技術
中餐烹調美食訓練班第02期,新竹市新竹市田美三街2號,2021/11/11,2021/12/11,在職,餐飲業
實作導向軟體人才就業培訓專班,新竹市五福路二段707號,2021/11/09,2022/03/07,青年,行政與管理
機械智動化與3D列印工程師訓練班-第2期,新竹市民族路31號11樓,2021/11/05,2021/12/01,青年,建築與工程
智慧機械製圖設計人才培訓班-第2期,新竹市民族路31號11樓,2021/11/05,2021/12/08,青年,建築與工程
智慧機械與AI人工智慧技術應用訓練班 -第2期,新竹市民族路31號11樓,2021/11/05,2021/12/15,青年,科技與資訊技術
數位攝影與影像編修實務班第01期,新竹市新竹市民族路31號11樓,2021/10/29,2021/11/29,在職,藝術與設計
智慧機械-3D機械設計製圖訓練班第01期,新竹市新竹市民族路31號11樓,2021/10/28,2022/01/13,在職,建築與工程
資料處理暨報表分析人員培訓班 第01期,新竹市,2021/10/28,2022/01/24,職前,行政與管理
庫存與物料管理班第01期,新竹市新竹市光復路二段350號5樓,2021/10/27,2021/11/27,在職,行政與管理
服飾品配件製作班第02期,新竹市新竹市田美三街2號,2021/10/27,2021/11/27,在職,藝術與設計
樂齡健康膳食料理班第01期,新竹市新竹市田美三街二號5樓,2021/10/26,2021/11/26,在職,餐飲業
財富管理-數位金融人才培訓班,新竹市東區光復路二段101號,2021/10/25,2021/12/01,青年,行政與管理
智慧機械-Python人工智慧圖像處理進階班第01期,新竹市新竹市民族路31號11樓,2021/10/19,2021/12/13,在職,科技與資訊技術
AI跨領域數據科學人才培訓班(第一梯次),新竹市大學路1001號,2021/10/19,2021/12/07,青年,建築與工程
光電與AI生醫產業人才養成班(第一梯次),新竹市大學路1001號,2021/10/19,2021/12/15,青年,建築與工程
新農業現代化創新農業管理班第03期,新竹市新竹市光復路２段101號,2021/10/17,2021/12/13,在職,行政與管理
品管資料處理行政人員培訓班 第01期,新竹市,2021/10/16,2022/05/27,職前,行政與管理
大數據資料分析速成班 第01期,新竹市,2021/10/06,2021/11/10,職前,科技與資訊技術
烘焙點心暨飲料製作班(身障專班) (新竹) 第01期,新竹市,2021/10/01,2022/02/14,職前,建築與工程
流行MV舞派對燃脂有氧班第01期,新竹市新竹市湳雅街147巷32號3樓,2021/09/30,2021/11/28,在職,科技與資訊技術
教練式溝通與表達技巧班第02期,新竹市新竹市工業東二路1號2樓,2021/09/30,2021/11/27,在職,行政與管理
熱情拉丁舞蹈訓練班第02期,新竹市新竹市湳雅街147巷32號3樓,2021/09/27,2021/12/22,在職,科技與資訊技術
BIM智慧建築與空間設計人才培訓班 第2梯,新竹市中華路二段391號,2021/09/15,2022/03/07,青年,建築與工程
金融科技人才養成班,新竹市南大路521號(線上為主，實體視需求而定),2021/09/06,2021/11/01,青年,行政與管理
智慧機械-無線控制與Arduino微控制器整合應用訓練班第01期,新竹市新竹市民族路31號11樓,2021/09/03,2021/12/28,在職,科技與資訊技術
大數據資料分析速成班 第01期,新竹市,2021/09/02,2021/09/16,職前,科技與資訊技術
車縫打版技能實作應用班(新住民專班) 第01期,新竹市,2021/09/01,2021/10/29,職前,建築與工程
智慧機械-SolidWorks智能居家3C產品設計進階班第01期,新竹市新竹市民族路31號11樓,2021/08/25,2021/12/25,在職,科技與資訊技術
工業模具機構設計人才培訓班,新竹市中華路二段391號,2021/08/15,2021/11/19,青年,建築與工程
新興食品生物技術應用班第01期,新竹市新竹市光復路２段101號,2021/08/03,2021/12/24,在職,行政與管理
新興食品生物技術應用班,30013新竹市新竹市光復路２段101號(清大第四綜合大樓303教室),2021/08/03,2021/09/03,在職,行政與管理
電腦影像美編設計(青年專班)(新竹)第02期,(300)新竹市新竹市龍山西路99號,2021/07/01,2021/10/18,青年,建築與工程
托育人員專業訓練課程(假日班) 第01期,新竹市,2021/06/21,2021/08/28,職前,行政與管理
無人機創客教育推廣人才培訓班,新竹市300東區光復路二段153號(私立光復高中),2021/06/14,2021/06/30,青年,行政與管理
美髮設計師人才 第01期,新竹市,2021/06/10,2021/07/12,職前,建築與工程
美髮準師專業人才 第01期,新竹市,2021/06/10,2021/07/12,職前,行政與管理
大數據資料分析班 第02期,新竹市,2021/06/09,2021/07/19,職前,科技與資訊技術
智慧機械與AI人工智慧技術應用訓練班,新竹市民族路31號11樓,2021/05/26,2021/06/30,青年,科技與資訊技術
智慧機械製圖設計人才培訓班,新竹市民族路31號11樓,2021/05/26,2021/08/02,青年,建築與工程
機械智動化與3D列印工程師訓練班,新竹市民族路31號11樓,2021/05/26,2021/08/16,青年,建築與工程
宅經濟複合式美食料理實務班(JD06)(青年融合式-新竹縣) 第01期,新竹市,2021/04/27,2021/07/05,職前,藝術與設計
中華大學先進製程積體電路佈局工程師人才養成班,新竹市香山區五福路二段707號,2021/04/27,2021/06/28,青年,建築與工程
經典中華料理廚藝技能培訓班 第01期,新竹市,2021/04/19,2021/08/31,職前,餐飲業
金融科技職場菁英養成班,新竹市東區大學路1001號國立交通大學綜合一館,2021/04/19,2021/06/28,青年,行政與管理
烘焙點心暨飲料製作班(身障專班) (新竹) 第01期,新竹市,2021/04/15,2021/09/07,職前,建築與工程
時尚美容美甲技能培訓班 第01期,新竹市,2021/04/07,2021/09/14,職前,藝術與設計
坐月子居家服務員訓練班 第01期,新竹市,2021/04/07,2021/07/05,職前,行政與管理
新媒體行銷與行政人員培訓班 第01期,新竹市,2021/04/07,2021/06/15,職前,行政與管理
美髮設計師就業班 第01期,新竹市,2021/04/06,2021/08/02,職前,建築與工程
智慧無人機巡檢培訓班,新竹市香山區五福路二段707號,2021/03/30,2021/07/26,青年,行政與管理
110年照顧服務員職業訓練 第01期,新竹市,2021/03/15,2021/08/28,職前,行政與管理
電腦影像美編設計(青年專班)(新竹)第01期,(300)新竹市新竹市龍山西路99號,2021/03/05,2021/07/27,青年,建築與工程
110年托育人員職業訓練班 第01期,新竹市,2021/02/25,2021/07/31,職前,行政與管理
110BT04托育人員職業訓練課程 第04期,新竹市,2021/02/25,2021/09/27,職前,行政與管理
110BT03托育人員職業訓練課程 第03期,新竹市,2021/02/25,2021/07/04,職前,行政與管理
智慧專業機械製造人才培訓班,新竹市五福路二段707號,2021/02/21,2021/04/12,青年,建築與工程
照顧服務員訓練F班(新竹市) 第04期,新竹市,2021/02/17,2021/11/16,職前,行政與管理
照顧服務員訓練數位1班(新竹市) 第-期,新竹市,2021/02/17,2021/11/25,職前,行政與管理
照顧服務員訓練E班(新竹市) 第03期,新竹市,2021/02/17,2021/09/29,職前,行政與管理
照顧服務員訓練甲班(新竹市) 第-期,新竹市,2021/02/17,2021/10/23,職前,行政與管理
照顧服務員訓練C班(新竹市) 第02期,新竹市,2021/02/17,2021/09/30,職前,行政與管理
國際企業經營班二年期日語組,新竹市新竹市,2021/01/05,2021/07/12,青年,行政與管理
國際企業經營班一年期經貿實戰組,新竹市新竹市,2021/01/05,2021/07/12,青年,行政與管理
實作導向軟體人才就業培訓專班,新竹市五福路二段707號,2020/11/02,2020/12/28,青年,行政與管理
企業AI實戰培訓班,新竹市香山區五福路二段707號,2020/10/22,2020/12/01,青年,行政與管理
跨境電商國際行銷企劃實務專班,新竹市香山區五福路二段707號,2020/10/21,2020/11/16,青年,行政與管理
離岸風電機電整合工程人才培訓班,新竹市香山區五福路二段707號,2020/10/01,2021/03/01,青年,行政與管理
電腦資料處理數據分析班(青年融合式-新竹市) 第01期,新竹市,2020/09/14,2020/12/21,職前,建築與工程
FPGA 系統晶片設計工程師培訓班,新竹市光復路2段321號,2020/08/24,2020/11/02,青年,建築與工程
時尚美髮設計師培訓班(區域性-新竹市) 第01期,新竹市,2020/08/24,2020/10/05,職前,建築與工程
針車操作技能培訓班(區域性-新竹市) 第01期,新竹市,2020/08/24,2020/10/05,職前,建築與工程
全球行銷企劃人才養成班,新竹市清大南大校區（南大路521號行政大樓3樓1305）、清大校本部（光復路二段101號研發大樓）、參訪巨城,2020/08/15,2020/10/08,青年,行政與管理
大數據資料分析與商業平台佈建人才養成班 第01期,新竹市,2020/07/16,2020/08/06,職前,科技與資訊技術
智慧機械製圖設計人才培訓班 第02期,新竹市,2020/06/23,2020/09/29,職前,建築與工程
電腦影像美編設計（新竹） 第01期,新竹市,2020/06/17,2020/10/19,職前,藝術與設計
智慧機械與自動控制培訓班 第02期,新竹市,2020/06/16,2020/08/31,職前,建築與工程
智能機械自動化人才培訓班 第03期,新竹市,2020/06/16,2020/08/12,職前,建築與工程
托育人員專業訓練課程班 第01期,新竹市,2020/06/10,2020/09/10,職前,行政與管理
電腦資料處理應用班(全職類-新竹) 第01期,新竹市,2020/05/30,2020/09/29,職前,建築與工程
經典中華料理廚藝技能培訓班 第01期,新竹市,2020/05/15,2020/07/15,職前,餐飲業
美味家常輕料理廚藝技能培訓班 第01期,新竹市,2020/05/15,2020/07/06,職前,餐飲業
創客工藝與文創商品製作班 第01期,新竹市,2020/05/01,2020/06/29,職前,藝術與設計
時尚美髮設計師培訓班 第01期,新竹市,2020/04/23,2020/06/08,職前,建築與工程
托育人員職業訓練班10903 第02期,新竹市,2020/04/20,2020/07/04,職前,行政與管理
坐月子居家服務員訓練班 第01期,新竹市,2020/04/08,2020/05/25,職前,行政與管理
智慧機械與AI技術應用培訓班 第01期,新竹市,2020/04/07,2020/09/01,職前,科技與資訊技術
創新產品設計人才培訓班 第01期,新竹市,2020/04/07,2020/06/16,職前,藝術與設計
托育人員專業訓練課程班 第01期,新竹市,2020/03/31,2020/07/04,職前,行政與管理
大數據資料分析師養成班第02期 第02期,新竹市,2020/03/18,2020/05/05,職前,建築與工程
109年托育人員職業訓練班 第01期,新竹市,2020/03/10,2020/08/08,職前,行政與管理
數位轉型人才養成班,新竹市光復路二段101號,2020/03/10,2020/08/24,青年,建築與工程
109年照顧服務員職業訓練在職班 第01期,新竹市,2020/03/07,2020/06/06,職前,行政與管理
托育人員職業訓練班10902 第01期,新竹市,2020/03/06,2020/05/11,職前,行政與管理
照顧服務員訓練E班(新竹市) 第01期,新竹市,2020/02/17,2020/10/08,職前,行政與管理
照顧服務員訓練B班(新竹市) 第01期,新竹市,2020/02/17,2020/09/15,職前,行政與管理
照顧服務員訓練甲班(新竹市) 第01期,新竹市,2020/02/17,2020/08/22,職前,行政與管理
照顧服務員訓練F班(新竹市) 第01期,新竹市,2020/02/17,2020/08/13,職前,行政與管理
照顧服務員訓練A班(新竹市) 第01期,新竹市,2020/02/17,2020/07/17,職前,行政與管理
照顧服務員訓練D班(新竹市) 第01期,新竹市,2020/02/17,2020/06/08,職前,行政與管理
智慧機器人設計人才培訓班 第01期,新竹市,2020/02/04,2020/04/27,職前,建築與工程
智慧機械與自動控制培訓班 第01期,新竹市,2020/02/04,2020/03/25,職前,建築與工程
大數據資料分析師養成班 第01期,新竹市,2020/01/15,2020/02/17,職前,建築與工程
縫紉技能多元應用班(新住民專班訓練-新竹市) 第01期,新竹市,2020/01/14,2020/03/31,職前,建築與工程
雙程式語言開發培訓班(技術類-新竹市) 第01期,新竹市,2020/01/13,2020/03/31,職前,建築與工程
智慧機械製圖設計人才培訓班 第01期,新竹市,2020/01/01,2020/03/09,職前,建築與工程
托育人員專業職業訓練班BT18 第03期,新竹市,2019/10/08,2019/10/26,職前,行政與管理
資料處理檢測人員培訓班(新竹) 第02期,新竹市,2019/10/03,2019/12/19,職前,行政與管理
品牌商業設計暨電子商務專班 第01期,新竹市,2019/09/18,2019/10/28,職前,行政與管理
美甲門市專業服務人員實務 第01期,新竹市,2019/08/05,2019/09/02,職前,行政與管理
平車拷克打版技能培訓班(新竹地區) 第01期,新竹市,2019/07/22,2019/10/21,職前,建築與工程
時尚美髮設計師訓練班 第02期,新竹市,2019/07/09,2019/09/27,職前,建築與工程
智能機械自動化人才培訓班 第02期,新竹市,2019/07/01,2019/11/18,職前,建築與工程
智能機械自動化人才培訓班 第01期,新竹市,2019/07/01,2019/09/18,職前,建築與工程
時尚美髮設計師培訓班 第01期,新竹市,2019/06/26,2019/07/22,職前,建築與工程
手沖咖啡暨輕食製作實務 第01期,新竹市,2019/05/28,2019/06/18,職前,藝術與設計
室內水電配線實務 第01期,新竹市,2019/05/20,2019/06/06,職前,行政與管理
托育人員專業職業訓練班BT14 第02期,新竹市,2019/05/02,2019/07/21,職前,行政與管理
托育人員專業職業訓練班BT13 第01期,新竹市,2019/05/02,2019/06/10,職前,行政與管理
108年托育人員職業訓練班 第01期,新竹市,2019/04/29,2019/06/01,職前,行政與管理
資料科學與大數據分析師養成班 第04期,新竹市,2019/04/25,2019/09/24,職前,建築與工程
資料科學與大數據分析師養成班 第03期,新竹市,2019/04/25,2019/07/09,職前,建築與工程
托育人員專業訓練課程班 第01期,新竹市,2019/04/25,2019/08/01,職前,行政與管理
複合式行動美容班 第01期,新竹市,2019/04/18,2019/08/02,職前,科技與資訊技術
RWD跨平台建置與手機多媒體應用班 第01期,新竹市,2019/04/08,2019/08/05,職前,科技與資訊技術
銀髮族全能服務人員培訓班 第01期,新竹市,2019/04/03,2019/08/26,職前,行政與管理
經典中華料理廚藝技能培訓班 第01期,新竹市,2019/04/01,2019/07/01,職前,餐飲業
時尚美髮設計師培訓班 第01期,新竹市,2019/03/26,2019/05/03,職前,建築與工程
坐月子居家服務員訓練班 第01期,新竹市,2019/03/26,2019/04/29,職前,行政與管理
智慧機械與自動控制培訓班 第01期,新竹市,2019/03/25,2019/07/08,職前,建築與工程
創新產品設計人才培訓班 第01期,新竹市,2019/03/25,2019/06/17,職前,藝術與設計
電腦品管資料處理人員培訓班(身心障礙者融合式訓練-桃園市) 第01期,新竹市,2019/03/12,2019/05/13,職前,行政與管理
資料科學與大數據分析師養成班 第02期,新竹市,2019/03/06,2019/04/23,職前,建築與工程
108年照顧服務員職業訓練在職班 第01期,新竹市,2019/03/01,2019/05/18,職前,行政與管理
照顧服務員訓練G班(新竹市) 第06期,新竹市,2019/02/19,2019/10/22,職前,行政與管理
照顧服務員訓練F班(新竹市) 第05期,新竹市,2019/02/19,2019/09/16,職前,行政與管理
照顧服務員訓練E班(新竹市) 第04期,新竹市,2019/02/19,2019/08/07,職前,行政與管理
照顧服務員訓練1班(新竹市) 第01期,新竹市,2019/02/19,2019/06/22,職前,行政與管理
照顧服務員訓練C班(新竹市) 第03期,新竹市,2019/02/19,2019/05/02,職前,行政與管理
照顧服務員訓練B班(新竹市) 第02期,新竹市,2019/02/19,2019/03/26,職前,行政與管理
照顧服務員訓練A班(新竹市) 第01期,新竹市,2019/02/19,2019/03/13,職前,行政與管理
資料科學與大數據分析師養成班 第01期,新竹市,2019/01/16,2019/02/11,職前,建築與工程
月子服務管理師職業訓練培訓班-新住民融合式訓練-新竹市縣及苗栗縣 第01期,新竹市,2019/01/15,2019/03/28,職前,行政與管理
手機介面UI/UX設計及響應式網頁內容製作應用班(身心障礙者融合式訓練-新竹市) 第01期,新竹市,2019/01/01,2019/03/28,職前,建築與工程
智慧機器人設計人才培訓班 第02期,新竹市,2018/10/24,2019/02/19,職前,建築與工程
創新智能產品設計人才培訓班 第03期,新竹市,2018/10/24,2019/01/08,職前,建築與工程
中華大學先進製程積體電路佈局工程師人才養成班(一),新竹市新竹市,,2020/03/02,青年,建築與工程
自強積體電路佈局人才養成班,新竹市新竹市,,2020/05/06,青年,建築與工程
中華大學先進製程積體電路佈局工程師人才養成班(二),新竹市新竹市,,2020/07/06,青年,建築與工程
國際企業經營班一年期經貿實戰組,新竹市新竹市,,2020/07/06,青年,行政與管理
國際企業經營班一年期英語組(新竹),新竹市新竹市,,2020/07/06,青年,行政與管理
國際企業經營班二年期德語組,新竹市新竹市,,2020/07/06,青年,行政與管理
國際企業經營班二年期西語組,新竹市新竹市,,2020/07/06,青年,行政與管理
國際企業經營班二年期日語組,新竹市新竹市,,2020/07/06,青年,行政與管理
國際企業經營班二年期英語組(新竹),新竹市新竹市,,2020/07/06,青年,行政與管理
